<?xml version="1.0" encoding="UTF-8"?>
<rendertheme xmlns:xsi="http://www.w3.org/2001/XMLSchema-instance" map-background="#FFFFFF"
	version="1" xmlns="http://opensciencemap.org/rendertheme"
	xsi:schemaLocation="http://opensciencemap.org/rendertheme https://raw.githubusercontent.com/mapsforge/vtm/master/resources/rendertheme.xsd">

	<stylemenu id="stylemenu" defaultvalue="BOLT_2" defaultlang="en">
      	<layer id="BOLT_2">
         	<name lang="en" value="Bolt2" />
         	<cat id="bolt2" />
         	<cat id="trails-osm" />
      	</layer>
   </stylemenu>

   <!-- region styles -->
   <!-- Footpath -->
   <style-line id="bolt2-footpath" cat="bolt2" stroke="#AAAAAA" width="0.5" dasharray="9,3" cap="butt" />
   <!-- Steps -->
   <style-line id="bolt2-steps" cat="bolt2" stroke="#000000" width="0.5" dasharray="9,9" cap="butt" />
   <!-- Cycle Trails (like MTB) -->
   <style-line id="bolt2-trail" cat="bolt2" stroke="#AAAAAA" width="1.1"/>
   <!-- Paved Tracks -->
   <style-line id="bolt2-track-paved" cat="bolt2" stroke="#AAAAAA" width="1.1" />
   <style-line id="bolt2-track-paved-cycle" use="bolt2-track-paved" />
   <!-- Non-paved tracks -->
   <style-line id="bolt2-track-raw" cat="bolt2" stroke="#555555" width="0.8" dasharray="3,3" />
   <style-line id="bolt2-track-raw-cycle" cat="bolt2" stroke="#555555" width="0.8" dasharray="6,3"/>
   <style-line id="bolt2-track-raw2" cat="bolt2" stroke="#555555" width="0.5" dasharray="3,3" />
   <style-line id="bolt2-track-raw-cycle2" cat="bolt2" stroke="#555555" width="0.5" dasharray="6,3"/>
   <!-- Tracks that don't have other info -->
   <style-line id="bolt2-track-other" cat="bolt2" stroke="#555555" width="1.1" dasharray="5,5" />
   <style-line id="bolt2-track-other-cycle" use="bolt2-track-other" stroke="#555555" />
   <!-- Paved Cycleways-->
   <style-line id="bolt2-cycle" cat="bolt2" stroke="#AAAAAA" width="1.1" />
   <!-- Elevation / contour lines-->
    <style-line id="bolt2-elevation-med-maj-z12" cat="bolt2" stroke="#550000" width="0.8"/>
	<style-line id="bolt2-elevation-med-maj-z13" cat="bolt2" stroke="#550000" width="0.64"/>
	<style-line id="bolt2-elevation-med-maj-z14" cat="bolt2" stroke="#550000" width="0.48"/>
	<style-line id="bolt2-elevation-med-maj-z15" cat="bolt2" stroke="#550000" width="0.365"/>
	<style-line id="bolt2-elevation-med-maj-z16" cat="bolt2" stroke="#550000" width="0.30"/>
	<style-line id="bolt2-elevation-med-maj-z17" cat="bolt2" stroke="#550000" width="0.24"/>
	<style-line id="bolt2-elevation-min-z13" cat="bolt2" stroke="#AA5500" width="0.64"/>
	<style-line id="bolt2-elevation-min-z14" cat="bolt2" stroke="#AA5500" width="0.48"/>
	<style-line id="bolt2-elevation-min-z15" cat="bolt2" stroke="#AA5500" width="0.365"/>
	<style-line id="bolt2-elevation-min-z16" cat="bolt2" stroke="#AA5500" width="0.30"/>
	<style-line id="bolt2-elevation-min-z17" cat="bolt2" stroke="#AA5500" width="0.24"/>
   <!-- end region -->

   <!-- region land/sea/waterways -->
   	<m e="way" k="natural" v="sea" >
     	<area cat="bolt2" fill="#00AAFF" />
   	</m>
   	<m e="way" k="natural" v="nosea">
      	<area cat="bolt2" fill="#ffffff" mesh="true" />
   	</m>
   	<m e="way" k="natural|landcover|landuse" v="wood|trees|scrub|forest">
	  	<area cat="bolt2" fill="#55FF55" fade="8" blend="12" blend-fill="#AAFFAA"/>
	  	<!--area cat="bolt2" src="icons/wood.svg" symbol-height="128" /-->
   	</m>
   	<m e="way" k="landuse" v="building">
	  	<area cat="bolt2" fill="#FFAAFF" />
   	</m>
   	<m k="amenity" v="hospital">
	  	<area cat="bolt2" fill="#FFAAFF" />
   	</m>
   	<m e="way" k="place" v="square" zoom-min="10">
      	<area cat="bolt2" fill="#FFFFFF" />
      	<!--line cat="bolt2" width="0.5" stroke="#000000" /-->
   	</m>
   	<m e="way" k="area" v="yes" zoom-min="10">
   		<m e="way" k="highway" v="pedestrian" zoom-min="10">
	      	<area cat="bolt2" fill="#FFFFFF" />
	      	<!--line cat="bolt2" width="0.5" stroke="#000000" /-->
	    </m>
   	</m>
   	<m e="way" k="area" v="yes" zoom-min="10">
   		<m e="way" k="highway" v="footway" zoom-min="10">
	      	<area cat="bolt2" fill="#AAAAAA" />
	      	<!--line cat="bolt2" width="0.5" stroke="#000000" /-->
	    </m>
   	</m>
   	<m e="way" k="leisure" v="park|nature_reserve">
      	<area cat="bolt2" fill="#AAFF55" />
	  	<!--area cat="bolt2" src="icons/park.svg" symbol-height="128" /-->
   	</m>
   	<m e="way" k="natural" v="wetland">
      	<area cat="bolt2" fill="#00FFAA" />
   	</m>
   	<m e="way" k="natural" v="beach" zoom-min="12">
      	<area cat="bolt2" fill="#FFFF00" />
   	</m>
   	<m e="way" k="man_made" v="cutline" zoom-min="14">
      	<line cat="bolt2" width="1" stroke="#AAAA55" />
   	</m>
   	<!-- endregion land/sea/waterways -->

   	<!-- region aeroway -->
   	<m e="way" k="aeroway" v="aerodrome">
		<area cat="bolt2" fill="#FFFFAA"/>
	</m>
   	<m e="way" k="aeroway" v="runway" zoom-min="10">
      	<line cat="bolt2" width="4" stroke="#AAAAFF" />
   	</m>
   	<m e="way" k="aeroway" v="taxiway" zoom-min="10">
      	<line cat="bolt2" width="2" stroke="#AAAAFF" />
   	</m>
   	<!-- endregion aeroway -->

	<!-- contour lines optimized for low-res displays interval = 10,(50/100)(Sony Xperia active)-->
	<!-- Contour lines below level 12 do not make sense because of the optimization prozessof the map-creator -->
	<!-- Level 12 + 13 do not render nice, there seems to be a bug in the renderer -->
	<!-- contour lines level 12 -->
	<m e="way" k="contour_ext" zoom-min="12" zoom-max="12">
		<m e="way" k="contour_ext" v="elevation_medium|elevation_major">
			<!--line use="bolt2-elevation-med-maj-z12"/-->
		</m>
	</m>
	<!-- contour lines level 13 -->
	<m e="way" k="contour_ext" zoom-min="13" zoom-max="13">
		<m e="way" k="contour_ext" v="elevation_minor">
			<line use="bolt2-elevation-min-z13"/>
		</m>
		<m e="way" k="contour_ext" v="elevation_medium|elevation_major">
			<line use="bolt2-elevation-med-maj-z13"/>
		</m>
	</m>
	<!-- contour lines level 14-->
	<m e="way" k="contour_ext" zoom-min="14" zoom-max="14">
		<m e="way" k="contour_ext" v="elevation_minor">
			<line use="bolt2-elevation-min-z14"/>
		</m>
		<m e="way" k="contour_ext" v="elevation_medium|elevation_major">
			<line use="bolt2-elevation-med-maj-z14"/>
		</m>
	</m>
	<!-- contour lines level 15-->
	<m e="way" k="contour_ext" zoom-min="15" zoom-max="15">
		<m e="way" k="contour_ext" v="elevation_minor" zoom-max="15">
			<line use="bolt2-elevation-min-z15"/>
		</m>
		<m e="way" k="contour_ext" v="elevation_medium|elevation_major">
			<line use="bolt2-elevation-med-maj-z15"/>
			<m e="way">
				<!--pathText k="ele" font-style="bold" font-size="8" fill="#000000" stroke="#ffffff" stroke-width="1.0"/-->
			</m>
		</m>
	</m>
	<!-- contour lines level 16 -->
	<m e="way" k="contour_ext" zoom-min="16" zoom-max="16">
		<m e="way" k="contour_ext" v="elevation_minor">
			<line use="bolt2-elevation-min-z16"/>
		</m>
		<m e="way" k="contour_ext" v="elevation_medium|elevation_major">
			<line use="bolt2-elevation-med-maj-z16"/>
			<m e="way">
				<!--pathText k="ele" font-style="bold" font-size="8" fill="#000000" stroke="#ffffff" stroke-width="1.0"/-->
			</m>
		</m>
	</m>
	<!-- contour lines level 17 and above -->
	<m e="way" k="contour_ext" zoom-min="17">
		<m e="way" k="contour_ext" v="elevation_minor">
			<line use="bolt2-elevation-min-z17"/>
		</m>
		<m e="way" k="contour_ext" v="elevation_medium|elevation_major">
			<line use="bolt2-elevation-med-maj-z17"/>
			<m e="way">
				<!--pathText k="ele" font-style="bold" font-size="8" fill="#000000" stroke="#ffffff" stroke-width="1.0"/-->
			</m>
		</m>
	</m>

	<!-- region lakes/reservoirs/peers over contour lines -->
	<m e="way" k="waterway" v="river|canal">
      	<line cat="bolt2" width="1" stroke="#00AAFF" />
      	<pathText display="always" cat="bolt2" fill="#0000AA" k="name" font-family="sans_serif" font-style="bold" priority="2" size="16" stroke="#ffffff" stroke-width="3.0" zoom-min="14" />
   	</m>
   	<m e="way" k="waterway" v="stream" zoom-min="14">
      	<line cat="bolt2" width="0.7" stroke="#00AAFF" />
   	</m>
   	<m e="way" k="waterway" v="river|riverbank|canal" closed="yes">
		<area cat="bolt2" fill="#00AAFF"/>
	</m>
	<m e="way" k="landuse" v="reservoir">
		<area cat="bolt2" fill="#00AAFF"/>
	</m>
	<m e="way" k="natural" v="water">
		<area cat="bolt2" fill="#00AAFF"/>
	</m>
	<m e="way" k="man_made" v="pier" zoom-min="12">
      	<line cat="bolt2" width="1" stroke="#FFFFAA" />
   	</m>
   	<m e="way" k="area" v="yes" zoom-min="12">
   		<m e="way" k="man_made" v="pier" zoom-min="12">
	      	<area cat="bolt2" fill="#FFFFAA" />
	    </m>
   	</m>
   	<!-- end region lakes/reservoirs/peers over contour lines -->

   	<!-- region military -->
   	<m e="way" k="landuse" v="military" zoom-min="10">
   		<line cat="bolt2" width="1" stroke="#FF5555" />
		<area cat="bolt2" src="icons/stripesDown.svg" symbol-height="32" />
	</m>
	<m e="way" k="area" v="yes" zoom-min="10">
		<m e="way" k="landuse" v="military" zoom-min="10">
   			<line cat="bolt2" width="1" stroke="#FF5555" />
			<area cat="bolt2" src="icons/stripesDown.svg" symbol-height="32" />
		</m>
	</m>
   	<!-- endregion military -->

   	<!-- boundary -->
   <m k="admin_level">
      <m v="2">
      	 <m zoom-min="3">
         	<line stroke="#AA00AA" width="2.5" cap="butt" />
         </m>
      </m>
   </m>
   <!-- endregion boundary -->

   	<!-- region tunnels: todo: bring in foreground, before <m e="way" k="natural|landcover|landuse" v="wood|trees|scrub|forest"> -->
   	<m e="way" k="tunnel" v="true|yes" zoom-min="8">
   		<m e="way" k="highway" v="service" zoom-min="13">
   		   <line cat="bolt2" stroke="#555555" width="1.0" dasharray="15,10" cap="butt" />
           <line cat="bolt2" stroke="#AAAAAA" width="0.6" dasharray="15,10" cap="round" />
        </m>
      	<m e="way" k="highway" v="residential|living_street|road|unclassified" zoom-min="13">
      	   <line cat="bolt2" stroke="#000000" width="2.3" dasharray="10,7" cap="butt" />